{
  "schema_version": "1.0",
  "session_id": "session-example-001",
  "event_id": "expression-example-0001",
  "sequence": 2,
  "frame_id": "frame-00421",
  "captured_at_mono_ms": 143220.4,
  "video_id": "mcm-lookbook-example-v1",
  "video_time_ms": 4200,
  "playback_epoch": 0,
  "producer_id": "fake-face-adapter",
  "model_revision": "fixture-revision",
  "taxonomy_version": "example-taxonomy-v0",
  "face_detected": true,
  "face_count": 1,
  "scores": {
    "unknown": 0.58
  },
  "quality": 0.79,
  "valid": true,
  "confidence": 0.82,
  "reason": null
}
